{
  "id": "inspection-run-001",
  "target": {
    "name": "example-service",
    "root": "./example-service",
    "commit": "abc1234"
  },
  "config": {
    "target": {
      "name": "example-service",
      "root": "./example-service",
      "commit": "abc1234"
    },
    "outputDirectory": "./inspection-output",
    "agentRoles": ["architecture", "qa"],
    "validationCommands": ["npm test"],
    "verbose": true
  },
  "status": "completed",
  "attempts": [
    {
      "id": "attempt-001",
      "agentId": "architecture-inspector",
      "role": "architecture",
      "status": "accepted",
      "startedAt": "2026-06-20T01:55:00.000Z",
      "completedAt": "2026-06-20T02:00:00.000Z",
      "findings": []
    }
  ],
  "findings": [],
  "qaResults": [],
  "revisionRequests": [],
  "memoryEvents": [],
  "knowledgeCards": [],
  "createdAt": "2026-06-20T01:50:00.000Z",
  "updatedAt": "2026-06-20T02:10:00.000Z"
}
